{
  "$schema": "https://json-schema.org/draft/2020-12/schema",
  "$id": "https://schemas.mm-chat.invalid/parser/synthetic-mineru-artifact.v1.schema.json",
  "title": "MM Chat test-only synthetic MinerU artifact v1",
  "description": "Closed offline-only single-role layout or middle fixture shape. It is not a live MinerU wire or coordinate contract. Pages are zero-based; rectangles are top-left-origin half-open xyxy integer milli-points. Cross-artifact validation proves matching source, profile, pages, geometry, and element identity.",
  "type": "object",
  "additionalProperties": false,
  "required": [
    "schemaVersion",
    "testOnly",
    "configNamespace",
    "goldenNamespace",
    "source",
    "profile",
    "role",
    "pages"
  ],
  "properties": {
    "schemaVersion": {
      "const": "synthetic-mineru-artifact.v1"
    },
    "testOnly": {
      "const": true
    },
    "configNamespace": {
      "const": "mm-chat.synthetic-mineru.config.v1"
    },
    "goldenNamespace": {
      "const": "mm-chat.synthetic-mineru.golden.v1"
    },
    "source": {
      "$ref": "#/$defs/source"
    },
    "profile": {
      "$ref": "#/$defs/profile"
    },
    "role": {
      "enum": [
        "layout",
        "middle"
      ]
    },
    "pages": {
      "type": "array",
      "minItems": 1
    }
  },
  "oneOf": [
    {
      "properties": {
        "role": {
          "const": "layout"
        },
        "pages": {
          "items": {
            "$ref": "#/$defs/layoutPage"
          }
        }
      }
    },
    {
      "properties": {
        "role": {
          "const": "middle"
        },
        "pages": {
          "items": {
            "$ref": "#/$defs/middlePage"
          }
        }
      }
    }
  ],
  "$defs": {
    "ordinal": {
      "$ref": "canonical-common.v1.schema.json#/$defs/ordinal"
    },
    "positiveSafeInteger": {
      "$ref": "canonical-common.v1.schema.json#/$defs/positiveSafeInteger"
    },
    "elementId": {
      "type": "string",
      "minLength": 1,
      "maxLength": 128,
      "pattern": "^[a-z][a-z0-9]*(?:[._-][a-z0-9]+)*$"
    },
    "elementKind": {
      "enum": [
        "text",
        "heading",
        "list",
        "table",
        "formula",
        "asset"
      ]
    },
    "source": {
      "type": "object",
      "additionalProperties": false,
      "required": [
        "documentId",
        "kind"
      ],
      "properties": {
        "documentId": {
          "type": "string",
          "minLength": 1,
          "maxLength": 128,
          "pattern": "^[a-z][a-z0-9]*(?:[._-][a-z0-9]+)*$"
        },
        "kind": {
          "const": "project_synthetic"
        }
      }
    },
    "profile": {
      "type": "object",
      "additionalProperties": false,
      "required": [
        "profileId",
        "pageIndexBase",
        "coordinateOrigin",
        "bboxConvention",
        "coordinateUnit"
      ],
      "properties": {
        "profileId": {
          "type": "string",
          "minLength": 1,
          "maxLength": 128,
          "pattern": "^[a-z][a-z0-9]*(?:[._-][a-z0-9]+)*$"
        },
        "pageIndexBase": {
          "const": 0
        },
        "coordinateOrigin": {
          "const": "top-left"
        },
        "bboxConvention": {
          "const": "zero-based-half-open-xyxy"
        },
        "coordinateUnit": {
          "const": "milli-point"
        }
      }
    },
    "layoutPage": {
      "type": "object",
      "additionalProperties": false,
      "required": [
        "pageIndex",
        "widthMilliPoint",
        "heightMilliPoint",
        "elements"
      ],
      "properties": {
        "pageIndex": {
          "$ref": "#/$defs/ordinal"
        },
        "widthMilliPoint": {
          "$ref": "#/$defs/positiveSafeInteger"
        },
        "heightMilliPoint": {
          "$ref": "#/$defs/positiveSafeInteger"
        },
        "elements": {
          "type": "array",
          "items": {
            "$ref": "#/$defs/layoutElement"
          }
        }
      }
    },
    "layoutElement": {
      "type": "object",
      "additionalProperties": false,
      "required": [
        "elementOrdinal",
        "elementId",
        "kind",
        "bboxMilliPoint"
      ],
      "properties": {
        "elementOrdinal": {
          "$ref": "#/$defs/ordinal"
        },
        "elementId": {
          "$ref": "#/$defs/elementId"
        },
        "kind": {
          "$ref": "#/$defs/elementKind"
        },
        "bboxMilliPoint": {
          "$ref": "canonical-common.v1.schema.json#/$defs/bboxMilliPoint"
        }
      }
    },
    "middlePage": {
      "type": "object",
      "additionalProperties": false,
      "required": [
        "pageIndex",
        "widthMilliPoint",
        "heightMilliPoint",
        "elements"
      ],
      "properties": {
        "pageIndex": {
          "$ref": "#/$defs/ordinal"
        },
        "widthMilliPoint": {
          "$ref": "#/$defs/positiveSafeInteger"
        },
        "heightMilliPoint": {
          "$ref": "#/$defs/positiveSafeInteger"
        },
        "elements": {
          "type": "array",
          "items": {
            "$ref": "#/$defs/middleElement"
          }
        }
      }
    },
    "middleElement": {
      "oneOf": [
        {
          "$ref": "#/$defs/textElement"
        },
        {
          "$ref": "#/$defs/headingElement"
        },
        {
          "$ref": "#/$defs/listElement"
        },
        {
          "$ref": "#/$defs/tableElement"
        },
        {
          "$ref": "#/$defs/formulaElement"
        },
        {
          "$ref": "#/$defs/assetElement"
        }
      ]
    },
    "textElement": {
      "type": "object",
      "additionalProperties": false,
      "required": [
        "elementOrdinal",
        "elementId",
        "kind",
        "bboxMilliPoint",
        "text"
      ],
      "properties": {
        "elementOrdinal": {
          "$ref": "#/$defs/ordinal"
        },
        "elementId": {
          "$ref": "#/$defs/elementId"
        },
        "kind": {
          "const": "text"
        },
        "bboxMilliPoint": {
          "$ref": "canonical-common.v1.schema.json#/$defs/bboxMilliPoint"
        },
        "text": {
          "$ref": "canonical-common.v1.schema.json#/$defs/nonEmptyUnicodeScalarString"
        }
      }
    },
    "headingElement": {
      "type": "object",
      "additionalProperties": false,
      "required": [
        "elementOrdinal",
        "elementId",
        "kind",
        "bboxMilliPoint",
        "level",
        "text"
      ],
      "properties": {
        "elementOrdinal": {
          "$ref": "#/$defs/ordinal"
        },
        "elementId": {
          "$ref": "#/$defs/elementId"
        },
        "kind": {
          "const": "heading"
        },
        "bboxMilliPoint": {
          "$ref": "canonical-common.v1.schema.json#/$defs/bboxMilliPoint"
        },
        "level": {
          "type": "integer",
          "minimum": 1,
          "maximum": 6
        },
        "text": {
          "$ref": "canonical-common.v1.schema.json#/$defs/nonEmptyUnicodeScalarString"
        }
      }
    },
    "listElement": {
      "type": "object",
      "additionalProperties": false,
      "required": [
        "elementOrdinal",
        "elementId",
        "kind",
        "bboxMilliPoint",
        "items"
      ],
      "properties": {
        "elementOrdinal": {
          "$ref": "#/$defs/ordinal"
        },
        "elementId": {
          "$ref": "#/$defs/elementId"
        },
        "kind": {
          "const": "list"
        },
        "bboxMilliPoint": {
          "$ref": "canonical-common.v1.schema.json#/$defs/bboxMilliPoint"
        },
        "items": {
          "type": "array",
          "minItems": 1,
          "items": {
            "$ref": "canonical-common.v1.schema.json#/$defs/nonEmptyUnicodeScalarString"
          }
        }
      }
    },
    "tableElement": {
      "type": "object",
      "additionalProperties": false,
      "required": [
        "elementOrdinal",
        "elementId",
        "kind",
        "bboxMilliPoint",
        "rows"
      ],
      "properties": {
        "elementOrdinal": {
          "$ref": "#/$defs/ordinal"
        },
        "elementId": {
          "$ref": "#/$defs/elementId"
        },
        "kind": {
          "const": "table"
        },
        "bboxMilliPoint": {
          "$ref": "canonical-common.v1.schema.json#/$defs/bboxMilliPoint"
        },
        "rows": {
          "type": "array",
          "minItems": 1,
          "items": {
            "$ref": "#/$defs/tableRow"
          }
        }
      }
    },
    "tableRow": {
      "type": "object",
      "additionalProperties": false,
      "required": [
        "rowIndex",
        "cells"
      ],
      "properties": {
        "rowIndex": {
          "$ref": "#/$defs/ordinal"
        },
        "cells": {
          "type": "array",
          "minItems": 1,
          "items": {
            "$ref": "#/$defs/tableCell"
          }
        }
      }
    },
    "tableCell": {
      "type": "object",
      "additionalProperties": false,
      "required": [
        "columnIndex",
        "rowSpan",
        "columnSpan",
        "text"
      ],
      "properties": {
        "columnIndex": {
          "$ref": "#/$defs/ordinal"
        },
        "rowSpan": {
          "$ref": "#/$defs/positiveSafeInteger"
        },
        "columnSpan": {
          "$ref": "#/$defs/positiveSafeInteger"
        },
        "text": {
          "$ref": "canonical-common.v1.schema.json#/$defs/unicodeScalarString"
        }
      }
    },
    "formulaElement": {
      "type": "object",
      "additionalProperties": false,
      "required": [
        "elementOrdinal",
        "elementId",
        "kind",
        "bboxMilliPoint",
        "sourceText"
      ],
      "properties": {
        "elementOrdinal": {
          "$ref": "#/$defs/ordinal"
        },
        "elementId": {
          "$ref": "#/$defs/elementId"
        },
        "kind": {
          "const": "formula"
        },
        "bboxMilliPoint": {
          "$ref": "canonical-common.v1.schema.json#/$defs/bboxMilliPoint"
        },
        "sourceText": {
          "$ref": "canonical-common.v1.schema.json#/$defs/nonEmptyUnicodeScalarString"
        }
      }
    },
    "assetElement": {
      "type": "object",
      "additionalProperties": false,
      "required": [
        "elementOrdinal",
        "elementId",
        "kind",
        "bboxMilliPoint",
        "mediaType",
        "contentSha256",
        "nonIndexable"
      ],
      "properties": {
        "elementOrdinal": {
          "$ref": "#/$defs/ordinal"
        },
        "elementId": {
          "$ref": "#/$defs/elementId"
        },
        "kind": {
          "const": "asset"
        },
        "bboxMilliPoint": {
          "$ref": "canonical-common.v1.schema.json#/$defs/bboxMilliPoint"
        },
        "mediaType": {
          "type": "string",
          "minLength": 3,
          "maxLength": 255,
          "pattern": "^[a-z0-9][a-z0-9!#$&^_.+-]*/[a-z0-9][a-z0-9!#$&^_.+-]*$"
        },
        "contentSha256": {
          "$ref": "canonical-common.v1.schema.json#/$defs/sha256"
        },
        "nonIndexable": {
          "const": true
        }
      }
    }
  }
}
