{"configNamespace":"mm-chat.synthetic-mineru.config.v1","goldenNamespace":"mm-chat.synthetic-mineru.golden.v1","pages":[{"elements":[{"bboxMilliPoint":[72000,72000,540000,108000],"elementId":"heading-0","elementOrdinal":0,"kind":"heading"},{"bboxMilliPoint":[72000,120000,540000,180000],"elementId":"text-0","elementOrdinal":1,"kind":"text"},{"bboxMilliPoint":[72000,200000,540000,340000],"elementId":"table-0","elementOrdinal":2,"kind":"table"},{"bboxMilliPoint":[72000,360000,300000,400000],"elementId":"formula-0","elementOrdinal":3,"kind":"formula"}],"heightMilliPoint":792000,"pageIndex":0,"widthMilliPoint":612000}],"profile":{"bboxConvention":"zero-based-half-open-xyxy","coordinateOrigin":"top-left","coordinateUnit":"milli-point","pageIndexBase":0,"profileId":"mm-chat.synthetic-mineru.offline-profile.v1"},"role":"layout","schemaVersion":"synthetic-mineru-artifact.v1","source":{"documentId":"offline-mineru-document-v1","kind":"project_synthetic"},"testOnly":true}