{"configNamespace":"mm-chat.synthetic-mineru.config.v1","goldenNamespace":"mm-chat.synthetic-mineru.golden.v1","pages":[{"elements":[{"bboxMilliPoint":[0,0,1000,1000],"elementId":"text-0","elementOrdinal":0,"kind":"text"}],"heightMilliPoint":1000,"pageIndex":0,"widthMilliPoint":1000}],"profile":{"bboxConvention":"zero-based-half-open-xyxy","coordinateOrigin":"top-left","coordinateUnit":"milli-point","pageIndexBase":0,"profileId":"mm-chat.synthetic-mineru.offline-profile.v1"},"role":"layout","schemaVersion":"synthetic-mineru-artifact.v1","source":{"documentId":"offline-mineru-document-v1","kind":"project_synthetic"},"testOnly":true}